{
  "$schema": "http://json-schema.org/draft-07/schema#",
  "$id": "https://github.com/sedhommarco/trading-copilot/data/schemas/market-regime.schema.json",
  "title": "Trading Copilot Market Regime",
  "description": "Schema for data/context/market-regime.json",
  "type": "object",
  "required": ["current_regime", "last_updated", "strategy_adjustments"],
  "properties": {
    "file_type": {
      "type": "string",
      "description": "Always 'market_regime'"
    },
    "current_regime": {
      "type": "string",
      "description": "Current market regime label. Use canonical values where possible.",
      "examples": [
        "trending bullish",
        "trending bearish",
        "choppy",
        "high volatility",
        "low volatility",
        "range bound"
      ]
    },
    "last_updated": {
      "type": "string",
      "description": "ISO 8601 datetime of last update"
    },
    "vix": {
      "type": "number",
      "description": "VIX spot value at time of refresh"
    },
    "trend": {
      "type": "string",
      "description": "Short trend description, e.g. 'uptrend', 'downtrend', 'sideways'"
    },
    "sentiment": {
      "type": "string",
      "description": "1-2 sentence market sentiment summary"
    },
    "sector_leaders": {
      "type": "array",
      "items": { "type": "string" },
      "description": "Top performing sectors this week"
    },
    "sector_laggards": {
      "type": "array",
      "items": { "type": "string" },
      "description": "Worst performing sectors this week"
    },
    "fed_policy": {
      "type": "string",
      "description": "Current Fed stance, e.g. 'data dependent', 'hawkish', 'dovish'"
    },
    "next_major_catalyst": {
      "type": "string",
      "description": "Next high-impact macro event or catalyst"
    },
    "strategy_adjustments": {
      "type": "object",
      "description": "Per-strategy plain-text adjustment notes. Keys must match the 5 canonical tab IDs.",
      "properties": {
        "macro-volatility": { "type": "string" },
        "earnings-momentum": { "type": "string" },
        "post-shock": { "type": "string" },
        "crypto": { "type": "string" },
        "pair-trades": { "type": "string" }
      },
      "additionalProperties": false
    },
    "notes": {
      "type": "string",
      "description": "Free-text weekly context note"
    }
  },
  "additionalProperties": false
}
